{
  "fileVersion": "0.4",
  "amgVersion": "1.0",
  "author": "Peter",
  "language": "de",
  "world": {
    "lmsElementIdentifier": {
      "type": "idNumber",
      "value": "123456789randomID"
    },
    "worldName": "Name der Welt",
    "worldDescription": "Beschreibung der Welt",
    "worldGoals": ["Ziel 1", "Ziel 2"],
    "topics": [
      {
        "topicId": 1,
        "topicName": "A",
        "topicContents": [1, 2]
      }
    ],
    "spaces": [
      {
        "spaceId": 1,
        "lmsElementIdentifier": {
          "type": "idNumber",
          "value": "123456789randomID"
        },
        "spaceName": "Name des Lernraums",
        "spaceDescription": "Beschreibung des Lernraums",
        "spaceGoals": ["Ziel 1", "Ziel 2"],
        "spaceSlotContents": [1, null, 2, 3, null, null],
        "requiredPointsToComplete": 100,
        "requiredSpacesToEnter": "(5)v((7)^(4))",
        "roomTemplate": "rectangle2x3",
        "roomTemplateStyle": "casino"
      }
    ],
    "elements": [
      {
        "elementId": 1,
        "lmsElementIdentifier": {
          "type": "moduleName",
          "value": "Ein wunderschöner, für den Nutzer sichtbarer, String"
        },
        "elementName": "Name des Elements",
        "elementDescription": "Beschreibung des Lernelements",
        "elementGoals": ["Ziel 1", "Ziel 2"],
        "elementCategory": "image",
        "elementFileType": "image:png",
        "elementMaxScore": 123,
        "elementModel": "ArcadeMachine"
      }
    ]
  }
}
